{
  "schemaVersion": "1.0",
  "kind": "candidate-source-built-cli",
  "source": {
    "implementationHead": "c8104f74de4af9d5131125eec54f402f20f9cd9f",
    "implementationTree": "5ee37c4a4b85e98a0007d17a407eeb29f0108e75",
    "authorityTrees": {
      "src": "9070bd3cd85773dd7844069841ceb4043edd2f57",
      "profiles": "7f8bd06e23ee78954e2e2c222f7b44a315049330",
      "external-tools": "8d83e508ec3b48e000e1bef39b4b215c81b886ad",
      "tools/crc-worker": "bba57c51cab02ddf89fefdf449eb585de7b34ae5"
    },
    "cleanTreeRequired": true
  },
  "freshBuild": {
    "sourceMaterialization": "detached-git-worktree",
    "emptyDestinationRequired": true,
    "rejectIgnoredBuildOutputsBeforeRestore": true,
    "forbiddenPathSegments": ["bin", "obj"]
  },
  "toolchain": {
    "resolvedSdkVersion": "10.0.303",
    "globalJson": { "path": "global.json", "size": 109, "sha256": "1497bda77ac26a91600f9eaa9d733be95a970961816c63738a4aafe1dc9c14e3" }
  },
  "lockFiles": [
    { "path": "src/NvtFwCombiner.Application/packages.lock.json", "size": 202, "sha256": "7caeed41b3bad2407a3ff34c212f80966b35b7294d94db6cb52953c29950d617" },
    { "path": "src/NvtFwCombiner.Bootstrap/packages.lock.json", "size": 2481, "sha256": "14991273997ad3449a59203a12581eb7d58b460d2e1387ceb0f760ca4f27a258" },
    { "path": "src/NvtFwCombiner.Cli/packages.lock.json", "size": 2837, "sha256": "d28b5a3dfbf82157ce1c6061da955478f29fc5c1722054a342f3d39cf3569123" },
    { "path": "src/NvtFwCombiner.Contracts/packages.lock.json", "size": 61, "sha256": "03eeadc5ef377c17f787ab65f41fb4c8a9c936bb7f7f4171111fdeec8a81cb46" },
    { "path": "src/NvtFwCombiner.Domain/packages.lock.json", "size": 61, "sha256": "03eeadc5ef377c17f787ab65f41fb4c8a9c936bb7f7f4171111fdeec8a81cb46" },
    { "path": "src/NvtFwCombiner.Infrastructure/packages.lock.json", "size": 1654, "sha256": "671a7562d6e49956024a1530b6d3989a895ce4d3cc4c98c062294ac589d6d991" },
    { "path": "src/NvtFwCombiner.Profiles/packages.lock.json", "size": 202, "sha256": "7caeed41b3bad2407a3ff34c212f80966b35b7294d94db6cb52953c29950d617" },
    { "path": "src/NvtFwCombiner.VersionManagement.Application/packages.lock.json", "size": 135, "sha256": "29dec3bc0547357d693e94a65cfc976d7dbc7cae3f7023ca5ab1492663df2493" },
    { "path": "src/NvtFwCombiner.VersionManagement.Infrastructure/packages.lock.json", "size": 1356, "sha256": "cbc0002d9813bcc078a84f78400f37cfdff1c6804a752aa500811b7bb56bfd34" }
  ],
  "externalTools": [
    { "path": "external-tools/catalog.json", "size": 4530, "sha256": "0c9079ba73ffd35d8c91fd89c40f3b0d89a79e31035b9e3b5b2781e16bc5dac9" },
    { "path": "external-tools/diff-nf-merge/1.0.0/CommandLine.dll", "size": 225280, "sha256": "e7d67580a8999d0e5534039f62e0dbc423b2d6dac51c2f5ff6ef199e4a53138d" },
    { "path": "external-tools/diff-nf-merge/1.0.0/DiffNFMerge.exe", "size": 9728, "sha256": "f611af7e315d46341e15cd7140eb3962f6ac05d337121e5554022ef5e69a2bbe" },
    { "path": "external-tools/diff-nf-merge/1.0.0/DiffNFMerge.exe.config", "size": 174, "sha256": "e2f8febf28b49915d142e4b698435d53b7eb3443853bd2892b86fe20e8895620" },
    { "path": "external-tools/diff-nf-merge/1.0.0/package-manifest.json", "size": 1466, "sha256": "de0c2c879842cc01e4ea03e3631c7fd455cb67a6a5bb3e6e9a818782f046b114" },
    { "path": "external-tools/legacy-combiner/1.13.0/Combiner.exe", "size": 41472, "sha256": "ed6b58289cc780f73d36b831f5424cef44ad93187ba7518d36df6a77ad0c76bf" },
    { "path": "external-tools/legacy-combiner/1.13.0/manifest.json", "size": 559, "sha256": "1c60badcc23fc5f3708d7cfb171a9a2e94c708a1aa257d0dac3efb7a20d96442" }
  ],
  "restore": {
    "workingDirectory": ".",
    "arguments": ["dotnet", "restore", "src/NvtFwCombiner.Cli/NvtFwCombiner.Cli.csproj", "--locked-mode", "--disable-parallel"]
  },
  "build": {
    "workingDirectory": ".",
    "arguments": ["dotnet", "build", "src/NvtFwCombiner.Cli/NvtFwCombiner.Cli.csproj", "--configuration", "Release", "--no-restore", "-m:1", "-p:ContinuousIntegrationBuild=true", "-p:PathMap={sourceRoot}=/_/src"]
  },
  "cliAssembly": {
    "path": "src/NvtFwCombiner.Cli/bin/Release/net10.0/NvtFwCombiner.Cli.dll",
    "size": 178688,
    "sha256": "221d2d158b594c3d614aad50b14557dde88d7be5a3c2010f5629974d5374a139"
  }
}
